{"approval_status":"UNREVIEWED","classification":"ILLUSTRATIVE_ANALYST_POLICY_NOT_FIRM_POLICY","editable_maximum_probability_choices":["0.08","0.10","0.15","0.20"],"falsifiers":{"gross_margin":"0.65","ordinary_cohort_nrr":"1.00","pipeline_conversion":"0.20","post_close_runway_months":12},"loss_definition":"gross_moic_below_1.0x","maximum_probability_below_one":"0.10","operating_hurdles":{"gross_margin":"0.70","ordinary_cohort_nrr":"1.05","post_close_runway_months":18},"owner":"Illustrative investment committee","rationale":"Illustrative policy thresholds are declared before analysis for the synthetic case. They are not an adopted firm policy and require human review.","receipt_sha256":"afafb5b6a38ad471fb54ac474de7676000798991c2dc6f14e86686cea92c1603","return_hurdles":{"gross_moic":"3.0","gross_xirr":"0.30"},"schema_version":"helios.risk-policy/v1"}
